{
  "$schema": "https://json-schema.org/draft/2020-12/schema",
  "$id": "https://agentlab.dev/schemas/artifact-manifest.v1.json",
  "title": "ArtifactManifest",
  "description": "Non-self-referential content-addressed manifest for one evidence scope: trial, batch, or StudyRun. Encodes SPEC sections 24.3 and 24.4.",
  "type": "object",
  "additionalProperties": false,
  "required": ["schema_version", "kind", "scope", "entries"],
  "properties": {
    "schema_version": {
      "const": 1
    },
    "kind": {
      "const": "ArtifactManifest"
    },
    "scope": {
      "type": "object",
      "additionalProperties": false,
      "required": ["level", "id"],
      "properties": {
        "level": {
          "type": "string",
          "enum": ["trial", "batch", "study"]
        },
        "id": {
          "$ref": "#/$defs/safeId"
        },
        "run_id": {
          "$ref": "#/$defs/safeIdOrNull"
        },
        "batch_id": {
          "$ref": "#/$defs/safeIdOrNull"
        },
        "study_run_id": {
          "$ref": "#/$defs/safeIdOrNull"
        }
      }
    },
    "created_at": {
      "$ref": "#/$defs/rfc3339"
    },
    "entries": {
      "type": "array",
      "minItems": 1,
      "items": {
        "type": "object",
        "additionalProperties": false,
        "required": [
          "path",
          "bytes",
          "sha256",
          "media_type",
          "producer",
          "sensitivity"
        ],
        "properties": {
          "path": {
            "type": "string",
            "pattern": "^[^/].*$",
            "minLength": 1,
            "description": "Scope-relative POSIX path; never absolute."
          },
          "bytes": {
            "type": "integer",
            "minimum": 0
          },
          "sha256": {
            "$ref": "#/$defs/sha256"
          },
          "media_type": {
            "type": "string",
            "pattern": "^[a-z0-9][a-z0-9!#$&^_.+-]*/[a-z0-9][a-z0-9!#$&^_.+-]*$",
            "minLength": 3
          },
          "producer": {
            "type": "object",
            "additionalProperties": false,
            "required": ["component", "version"],
            "properties": {
              "component": {
                "type": "string",
                "pattern": "^@[a-z0-9][a-z0-9.-]*/[a-z0-9][a-z0-9.-]*$|^[a-z][a-z0-9._-]*$",
                "minLength": 1
              },
              "version": {
                "$ref": "#/$defs/semver"
              }
            }
          },
          "sensitivity": {
            "type": "string",
            "enum": ["redacted", "operator", "sensitive", "public"]
          },
          "child_manifest": {
            "type": "boolean",
            "description": "Marks a referenced child manifest digest instead of a leaf payload."
          }
        }
      }
    }
  },
  "$defs": {
    "safeId": {
      "type": "string",
      "pattern": "^[A-Za-z0-9][A-Za-z0-9._-]{0,127}$"
    },
    "safeIdOrNull": {
      "type": ["string", "null"],
      "pattern": "^[A-Za-z0-9][A-Za-z0-9._-]{0,127}$"
    },
    "sha256": {
      "type": "string",
      "pattern": "^[a-f0-9]{64}$"
    },
    "rfc3339": {
      "type": "string",
      "pattern": "^\\d{4}-\\d{2}-\\d{2}T\\d{2}:\\d{2}:\\d{2}\\.\\d{3}Z$"
    },
    "semver": {
      "type": "string",
      "pattern": "^\\d+\\.\\d+\\.\\d+(-[0-9A-Za-z.-]+)?(\\+[0-9A-Za-z.-]+)?$"
    }
  }
}
