{
  "schema_version": 1,
  "kind": "ArtifactManifest",
  "scope": {
    "level": "trial",
    "id": "run-01"
  },
  "created_at": "2026-01-15T09:41:12.512Z",
  "entries": [
    {
      "path": "trials/run-01/trace.jsonl",
      "bytes": 48102,
      "sha256": "aaaaaaaaaaaaaaaaaaaaaaaaaaaaaaaaaaaaaaaaaaaaaaaaaaaaaaaaaaaaaaaa",
      "media_type": "application/x-ndjson",
      "producer": {
        "component": "@agentlab/evidence",
        "version": "0.1.0"
      },
      "sensitivity": "redacted"
    }
  ]
}
